[{
                      "flineName": "Delta",
                      "fCode": "A1B2C3",
                      "fDepdate": "2015/03/20",
                      "fDestin": "SFO",
                      "fEmptyseats": "40",
                      "fOrgin": "MUA",
                      "fPlanetype": "Boing 737",
                      "fprice": "400.0"
                    },
                    {
                      "flineName": "Delta",
                      "fCode": "A1B2C4",
                      "fDepdate": "2015/02/11",
                      "fDestin": "LAX",
                      "fEmptyseats": "10",
                      "fOrgin": "MUA",
                      "fPlanetype": "Boing 737",
                      "fprice": "199.99"
                    }
                   ]
                   